Label;Comment;;;;;;"if you guys like trump"" because he speaks what's on his mind "" ...the rest of us know thats code for "" i like him becAuse hes a fuc*ing racist bastard and so am i"" ";;;;;;#fuc*donaldjtrump;;;;;;So many white people........ Sooooooo many white people!!;;;;;;if you play this at 0.5 speed from about 0:40 its frickin hilarious;;;;;;like a drunk guy ranting to you at 3 in the morning on the sidewalk;;;;;;I'm not a supporter, but this video already feels historic. I wonder what horrific incidences will befall us soon;;;;;;The man is delusional.;;;;;;God Bless America and God bless Donald Trump!;;;;;;nice vid i luv donald;;;;;;8:34 is priceless!;;;;;;people of the world the dumbest thing I've ever heard! 0:48;;;;;;It is too bad the epitomy of capitalist greed will be quickly squashed by the righteous red army, poised to give back to the proletariat. Proletarskij internacionalizm!;;;;;;im in Canada and cant help but laugh that your new PRESIDENT had to use Bane from Batman Quotes  man what a joke. have a good 4 years Murica;;;;;;"Trump supporters won't be hurt for their anger, they'll be hurt by their anger...your anti mex and Muslim rhetoric will haunt you...our neighbor to the south and former ally along with countless others will turn on us due to his false rhetoric...if any Trump supporters read this, remember what Dr king told you ""judge people by the content of their character"" , ";;;;;;"I love how he added ""Make America Proud Again"" to the usual four-pronged MAGA speech ending.  Pumped me up. , ";;;;;;Give me 12 of the best examples of MAGA and if there true I'll join Trump.;;;;;;i love trump!;;;;;;killersoap88 ...;;;;;;YOU GO TRUMP;;;;;;Shut up f*** you;;;;;;I`m watching this in 1984.;;;;;;Nobody clap so sad lol;;;;;;I hate trump I thought there would be more hate comments;;;;;;I will never acknowledge this' extremely un qualified racist piece of shit as president.... f*** him......and fuck all you mother fuckers that voted for this waste of human flesh... ;;;;;;" but I  think I understand , you peckkkerwoods  and minority Coons, , had to deal with a smart, smooth, suave brutha running our country for 8 years .... and that had to hurt your little white egos ... so now your revenge, is to vote in the most unqualified motherfucker since Gerald ""fucking "" Ford  all the sudden the possibility of someone like Sarah Palin being president  doesn't seem that bad.. I mean don't get me wrong. she's  a  dizzy bitch.. but at least she knows something about politics...But the  Orange cocksucker sitting in Obama's house now.. is a disgrace and embarrassment.. and he really is going to destroy this country.. the only hope for America, is that  he resign... or  we impeach him ... unless we get lucky and he dies in office.. Ill. be praying on one of the three. , ";;;;;;people didnt like obama because his policies were terrible.;;;;;;Down with the wall down with the wall down with the wallllll;;;;;;Congrats to Trump and the American people on his win from Canada! please tell him to send someone to assassinate Trudud please?;;;;;;i will find the people who disliked this with the full power of the 2nd amendment;;;;;;Someone should have assassinated him during the speech;;;;;;trump is a joke ;;;;;;"6:34 LMFAO This is actually taken from Bee Movie!! ""We are one colony -- and their pain is our pain. Their dreams are our dreams";" and their success will be our success. We share one heart, one hive and one glorious destiny"" yall might want to rewatch that movie xDDDDDD , ";;;;;;;;;;;American complaining about Trump..Shut the fuck up...much than a half of American population  voted for him..u voted for him u are the psychos..have a good life with a fascist old man ruling ur country..;;;;;;Donald Trump is a orange with a Caterpillar taupe;;;;;;the day america let a nazi take over;;;;;;Ahh the tears of salty Liberals;;;;;;Fuck the RepubliTards;;;;;;"14:24 ""We stand at the birth of a loo millennium."" , ";;;;;;fuck trump;;;;;;Brilliant speech Mr. President!;;;;;;Don't talk about Russell Means speeches like that it's an understatement.;;;;;;America's root is christian, goodbye fucking muslim;;;;;;Islam isn't a race;;;;;;Love him or hate him. Donald trump has rocked the world!;;;;;;MrDutto As did Hitler.;;;;;;Trump= Hitler!;;;;;;"As for the ridiculous hundred million Slavs, we will mould the best of them as we see fit, and we will isolate the rest of them in their own pig-styes; and anyone who talks about cherishing the local inhabitants and civilising them, goes straight off into a concentration camp! Adolf Hitler";;;;;;;;;;;;"The white races did, of course, give some things to the natives, and they were the worst gifts that they could possibly have made, those plagues of our own modern world-materialism, fanaticism, alcoholism and syphilis. For the rest, since these peoples possessed qualities of their own which were superior to anything we could offer them, they have remained essentially unchanged. Where imposition by force was attempted, the results were even more disastrous, and common sense, realizing the futility of such measures, should preclude any recourse to their introduction. One solitary success must be conceded to the colonizers: everywhere they have succeeded in arousing hatred, a hatred that urges these peoples, awakened from their slumbers by us, to rise and drive us out. Indeed, it looks almost as though they had awakened solely and simply for that purpose! Can anyone assert that colonization has increased the number of Christians in the world? Where are those conversions en masse which mark the success of Islam? Here and there one finds isolated islets of Christians, Christians in name, that is, rather than by conviction; and that is the sum total of the successes of this magnificent Christian religion, the guardian of supreme Truth! Taking everything into consideration, Europe's policy of colonization has ended in a complete failure. Adolf Hitler";;;;;;;;;;;;At the outset of the German Government's movement against the Jews, an American visitor asked Herr Hitler why he was making it so ruthless. The Reichskanzler replied that he had got the idea from us. Americans, he said, are the great rope and lamppost artists [i.e., lynching] of the world, known of all men as such. He was using the same methods against the Jews that we used against the loyalists of 76, the Indians, the Chinese on the Western coast, the Negroes, the Mexicans, the Filipinos  every helpless people in fact whom we had ever chanced to find underfoot.  A.J. Nock, 1941;;;;;;;;;;;;The peoples of Islam will always be closer to us than, for example, France. Adolf Hitler;;;;;;;;;;;;In the Spanish people there is a mixture of Gothic, Frankish and Moorish blood. One can speak of the Spaniard as one would speak of a brave anarchist. The Arabian epochthe Arabs look down on the Turks as they do on dogswas the most cultured, the most intellectual and in every way best and happiest epoch in Spanish history. It was followed by the period of the persecutions with its unceasing atrocities.;;;;;;1 August 1942.  Adolf Hitler;;;;;;;;;;;;"Had we been on our own, we could have emancipated the Moslem countries dominated by France; and that would have had enormous repercussions in the Near East, dominated by Britain, and in Egypt. But with our fortunes linked to those of the Italians, the pursuit of such a policy was not possible. All Islam vibrated at the news of our victories. The Egyptians, the Irakis and the whole of the Near East were all ready to rise in revolt. Just think what we could have done to help them, even to incite them, as would have been both our duty and in our own interest! But the presence of the Italians at our side paralysed us; it created a feeling of malaise among our Islamic friends, who inevitably saw in us accomplices, willing or unwilling, of their oppressors. For the Italians in these parts of the world are more bitterly hated, of course, than either the British or the French. The memories of the barbarous, reprisals taken against the Senussi are still vivid. Then again the ridiculous pretensions of the Duce to be regarded as The Sword of Islam evokes the same sneering chuckle now as it did before the war. This title, which is fitting for Mahomed and a great conqueror like Omar, Mussolini caused to be conferred on himself by a few wretched brutes whom he had either bribed or terrorized into doing so. We had a great chance of pursuing a splendid policy with regard to Islam. But we missed the bus, as we missed it on several other occasions, thanks to our loyalty to the Italian alliance! In this theatre of operations, then, the Italians prevented us from playing our best card, the emancipation of the French subjects and the raising of the standard of revolt in the countries oppressed by the British. Such a policy would have aroused the enthusiasm of the whole of Islam. It is a characteristic of the Moslem world, from the shores of the Atlantic to those of the Pacific, that what affects one, for good or for evil, affects all. Adolf Hitler";;;;;;;;;;;;So, do you really know who was Adolf Hitler and what was his ideology before comparing Trump to him?;;;;;;THIS MADE ME LOVE MY COUNTRY AGAIN!;;;;;;I know it used to be awesome to bad he's not talking about that SPECIFIC TYPE of awesomeness.;;;;;;We would have been more united as a people if Bernie was the canidante instead of Hilary. But thanks to all you Hardcore Hilary Supporters and the bs that happen during the democratic primaries, we have Trump.;;;;;;Trump should immediately end the role of bodyguard in certain European countries, such as Germany for example.;;;;;;This country today has its public coffers well stuffed, thanks to the American taxpayer who is supporting part of the German defense.;;;;;;go trump;;;;;;Terminal Lance brought me here.;;;;;;I watch this all the time!;;;;;;Were proud of you Donald Trump for fighting for the American people !;;;;;;Ronmiester R Don't talk about Russell Means like that. It brings me tears of joy.;;;;;;I think it is a great speech;;;;;;Victoria Phelan  What do you think of this Speech ----> https://youtu.be/_8Lri1-6aoY;;;;;;All HAIL GLORIOUS LEADER!!! THE GOD EMPEROR!!!;;;;;;HELL YEA! Bye Obama's and Clinton's! Time for a real leader to lead this country! #MAGA;;;;;;Brandon Farwell;;;;;;the military spending is costing more money. Who told you healthcare and free college will bankrupt the richest country. because they're are plenty of countries that have it.   well that's good for you you got a raise because im still in poverty. And so are Native Americans. Elizabeth warren and Ron Paul were the only ones that i heard mention their 3rd world poverty in the richest country in world? Hmmm that's not suspicious at all.;;;;;;;;;;;;here's one reason why you dont the pipeline. https://youtu.be/xJlIwTTd5qw even though they're still prisoners of war;;;;;;;;;;;;And like i said What about the wars he's starting that Bernie wants to end?;;;;;;yes;;;;;;TRUMP!;;;;;;Cough Cough Russell Means!;;;;;;"Regardless who or what you think of the man, show some repect! This society is out of control. I do have to say this man is very ""handy"". His hand movements seem very I am jot quite sure, out of sync maybe? I would like to see him on the real issues, min wage who in god name can live on 10.00 an hour? What does he know about struggle when it is monetary ? , ";;;;;;Just one last one. The Trump House!;;;;;;WWIII;;;;;;Thank you President^.^;;;;;;;;;;;;Your inaugural address encouraged me to write^.^;;;;;;;;;;;;As you care about our kids, do you think it is right to teach that monkey became human being in school?? ;;;;;;;;;;;;"And do you know the Bible says, """"So GOD CREATED MAN in HIS OWN IMAGE"; in the image of GOD HE created him;" male and female HE created them.""  (Genesis 1:27)";;;;;;;;;;Will you correct this fraud? PLEASE!;;;;;;50 cent in da club;;;;;;so......what happened in Sweden, lmfao;;;;;;We fucked up bigly.;;;;;;THAT IS A SMALL CROWD;;;;;;All these butt hurt Clinton supporters disliking the video because they can't even handle the fact that an actual good president has finally come to save us.;;;;;;America is fucked.;;;;;;HOIII!!!;;;;;;For all you talking smack about Trump, it's not like Clinton would be any better.;;;;;;#Jawshtrap Don't try to excuse yourself, idiot, Clinton would (despite being a bitch) be better for average americans.;;;;;;#AMERICAFIRST pass it on.;;;;;;#quad_core Never was first and never will be. US is the biggest ongoing joke on the planet and the orange ape just made the joke even bigger. :-);;;;;;First they ignore you, then they laugh at you, then they fight you, then you win. (Mahatma Gandhi);;;;;;"you call his whole base ""racist's and bigot's""  so that means you're assuming they're white so wouldn't you be a racist and a bigot??? saying all white people that voted for Trump are racist and bigots is like saying all Black Obama supporters are criminals racist ..... see how stupid that logic is , ";;;;;;American history is being stained orange.;;;;;;Winning just like never BEFORE not WHINNING just like never before;;;;;;good words for donald trump for open-minded speaking and open-hearted patriotism with honesty and loyalty in american faith, pride and humility too;;;;;;It could have been a Hillary Clinton Inauguration rather than Trump. #Go Democrats 2020!;;;;;;Actions speak louder than words.;;;;;;Easier said than done.;;;;;;Don't be afraid of someone who talks a lot.;;;;;;Any person that watched all of this and liked it is a sick person. This is by far the worst inauguration speech done by any American president.;;;;;;"There is nothing memorable here. The hubris and body language is really disgusting here. Forget about the ""only thing one has to fear is fear itself"" by FDR or ""don't ask what the country can do for you but what you can do for the country"" by JFK. Those two presidents did not come across like a**holes like Trump. , ";;;;;;I Hope someone will KILL you Donld J Trump  You are the son of Adolf Hitler the NAZI PIG;;;;;;The tolerant left in a nutshell...;;;;;;Trump is an idiot - Hillary is an idiot: No one wins.;;;;;;Lies, I'm not a Hillary supporter nor Trump supporter, what Trump says is all lies, just like Obama. ;;;;;;TBH, I rather have orange man than a fucking cunt.;;;;;;16:25 Dig it;;;;;;Brian Any evidence? Dont judge. Explain and show me exact sources if you are right;;;;;;Rusted-out factories scattered like tombstones across the landscape of our nation.;;;;;;Greatest Speech since Regan;;;;;;mmmmm, fuck my ass;;;;;;nightmare on pennsylvania elm street;;;;;;IS THIS REAL LIFE??????????;;;;;;Peoples ....maybe the mouthpiece spitting the right words. ..but if he won't closed Federal Reserve Bank and support Israel. HE'S NOT REAL.;;;;;;Muslims are afraid now cause once you deport Juan, you deport Jamal aswell;;;;;;No matter how much you hate Trump, ya gotta admit that he's got quite the speech;;;;;;Come on Donald, mawa!;;;;;;Every time I view this great moment, I revel in the idea that it is making libtards all across our land so angry that they can hardly avoid crapping themselves.  This is a moment I have prayed for since the ignorant masses elected President Trump's commie predecessor.  I watched McCain fold like a house of cards in defeat then was blessed to be alive to watch Hillary cower with disbelief as middle Americans spoke and placed a real patriot in the White House.;;;;;;My god you all really fucked up.. this hand gesturing moron is a desperate pathetic individual.;;;;;;How can so many have got it so wrong??;;;;;;;;;;;;This all really reflects poorly on Americans obsession with rich's and rich Peaple;;;;;;we ll see...;;;;;;"When my parents and I watched this when he was talking about Obama he was like ""Barack Obama you have failed this country , ";;;;;;Wow.......America's fucked;;;;;;I agree with the guy that said he will wait to see . If he can do what he said he will do,and then we elect another president like him ,given we benefit from it.;;;;;;Im behind him all the way.I do however have one suggestion for Mr.Trump ,stay the hell off twitter with these back and forths with celebrities .lol.Also,despite the mess Bill clinton got himself into while running his term, most of America had a job.He was a courageous president that didnt take crap from anyone.;;;;;; everyone so afraid of nuclear war.all i fear is surviving it.and i dont think any other country wants to go through it either . conventional war is far worse imo.;;;;;;    what I really want is for my children to have the freedom of religion in school again and be able to recite the pledge of allegiance . instead of worrying if some musilim kid is going to be offended.;;;;;;its their right to stay seated if the feel it neccesary;;;;;;more sense coms out of my noz than his gob;;;;;;May I ask a voting here? Will you welcome those refugees into america.Thumbs up if  you like them to come.Thumbs down if you do not;;;;;;"One of the only things I genuinely disagreed with Obama about was his refusal to talk about ""Radical Islamic Terrorism."" , ";;;;;;ah nu penting mah beuteung seubeuh , duit gableg loba ,  awewe geulis sakuriling aing teu dibaraju , mabok unggal poe , gawe ngan ukur hees , naon deui atuh , paduli saha presidenna oge;;;;;;Trump is the chosen one for all the american. Historical 45th President  since 1945. We salute you. There is similarities with your Trump and our President Duterte which is The Two Rules: For the people and for the country. Same with the Holy Bible Two very important command of GOD: For the Love of GOD & For the Love of People. But we are on the final century, how can you love people if the man is already a Demon!!! Trump & The Rule of LAW solid support to the benefits of all American people!;;;;;;now lets see if the trumpf regime even makes it to the summer. 3-0 ninth circuit ruling, Flynn's gone, puzder's out, signs of contact with the russians going back before he took office yikes... rocky start;;;;;;11:35 there is even a arab trump sopportee yay;;;;;;the world's about to start all because of you all have a vote for Donald Trump;;;;;;Way to get all of these kidz from twitter Mr Trump.;;;;;;We'll make a bar in rural Connecticut called the Brown Lady.;;;;;;#BLACKSFORTRUMP GREAT SPEECH N IM TIRD OF SEEING THESE MAD ASS CLINTON SUPPORTERS;;;;;;3 weeks in office and already fat neck deep in corruption, treason and incompetence. He might just dethrone nixon as the most hated american president in history.;;;;;;I just can't forget this moment, felt so happy.;;;;;;I WISH HES NAME WAS DONALD DUCK;;;;;;America had slaves! Trump is a meaniehead!;;;;;;And you're what, 4?;;;;;;I'm getting a whiff  of Germany 1933. So what s changed virtual all large American/European electronics, steel and fabrication business our manufactured in good  great democracy of China  or the far east well done corporate  USA/Europe  . All you need to do is look at where a item has been manufactured. Its the American/European corporate greed  that has ruined its own and they do not  give a f***. profit profit for the few. ;;;;;;Long live the good old US of A  and good Luck. ;;;;;;p.s;;;;;;Americans check  ( you need to know  the truth )the foreign direct investment in American Companies and Banks you thought Obama Carer was socialist you have not got a clue America is owned and in colossal debt to one particular country (China) oh dear corporate America  has sold its own down the river.   A rely nice  example Social Darwinism.;;;;;;Great speech!!!!!!;;;;;;Impeach the trash Donald thrump today;;;;;;so much winning...;;;;;;Already Trump is the greatest President ever!;;;;;;President Trump is the right President for an Ethiopian dictators. I am so happy.He won.Thank God !!!;;;;;;Trump Nation;;;;;;No Its a federal reserve nation. in fact the world is one giant Indian reservation. (Russell Means);;;;;;To all people worldwide: spiritual, religious, meditative - all people of good will. I think to ridicule D. Trump is not a blissful attitude and to fight might lead to more fighting... So I would like to introduce the idea of COLLATERAL ENLIGHTENMENT: please meditate and pray for the peace, bliss and joy of all beings, but especially for D. Trump, that he may be a Blessing to the world and not a ...;;;;;;Trump sure talks a lot. Got a pounding headache just by watching the first 5 minutes.;;;;;;What the F[|< are you talking about?;;;;;;so this is how liberty dies with thunderous applause;;;;;;miserable moron who will be soon impeached;;;;;;why does chuck Schumer look like the scrooge? ;;;;;;Quite an exciting speech;;;;;;I will watch this speech each time I forget what he stands for.;;;;;;Mr. President, do what you have to do to make America great again. Obama abused the executive orders, and through his tyranny caused chaos all throughout the land. Now's that you're in office you can, and have been, using the power of the executive orders to reverse the damage. Drain the swamp, Mr. President. Control our borders and stop these 3rd world immigrants from flooding in and displacing the whites. It's time to make America great again! Do It Right! Make America White!;;;;;;it s best do world people thanks chif.,;;;;;;I found this speech inconsequential.;;;;;;This guy embodies the American dream. If he can make it, anyone can!;;;;;;Where is the word Humble;;;;;;The greatest President. Martyrdom will only make him and his American ideals more widespread;;;;;;Exposing his insanity will EDUCATE you how and why you're wrong.;;;;;;;;;;;;Truth isn't found in the bible nor on extremist alt-right radio. Truth is found through cooperation, not isolation, and the lies you've been led to believe will ruin you and America all while you mindlessly follow the right claiming it's all the left's fault.;;;;;;Let's see how America's first orange president does;;;;;;Let's not, and impeach him asap.;;;;;;not even one month into his presidency, and now everyone hates him, everyone;;;;;;He's censoring the media and government appointed scientists. He's unconstitutional and needs to be impeached.;;;;;;IMPEACH THIS NAZI;;;;;;"The word ""Nazi"" is always the quickest way to reveal a lack of credibility , ";;;;;;Rot in Hell Trump you fuck! Die you fascists cock sucking Trump supporters from hell. Eat shit, suck a donkeys green cock and die you fucks. may you fascists GOP right wing fucks eat so much shit you puke and die you fucks. god damn it. you fucks!!!!!;;;;;;fuck him;;;;;;At first I was disappointed Trump became president but after only seeing him take action already as president and going by his every word, I am so happy and grateful Trump won the presidency and became our president. He's saving America's jobs and economy. Businesses have been laying off Americans to give jobs to foreigners that at 3 times cheaper. It is nearly impossible for the people laid off to even get hired by another company. Trump is now going to change that where foreigners must be paid at least a certain amount in order to work. This means there will no longer be layoffs and Americans can keep their jobs. And my mom who is one of the few people in her work who hasn't been laid off, can keep her job or even find job opportunities. Thank you Trump for saving America and making it great again! (:;;;;;;"What he proposes will strengthen the dollar, raise prices, and the fact you keep your ""higher"" paying job will wind up being a wash.";;;;;;;;;;;;More importantly, he's a thin skinned psycopath with access to the nuclear launch codes. We're all going to f*cking die, Melissa.;;;;;;why did all the guys in uniform come down and stand behind him, then leave?;;;;;;Disorganization from top to bottom. No one knows what they're doing in this administration;;;;;;oh my god the president of the united States wants to look out for US interests before anything else... what a racist!;;;;;;Ger Vas did you even read the tax code? It cuts everyones taxes;;;;;;I'll have two number 9's, a number 9 large, a number 6 with extra dip, a;;;;;; number 7, two number 45's, one with cheese, and a large soda. oops this isnt mcdonlads is it.;;;;;;"Historic: The first orange ""president"" followed by the first black President of the United States.  orange is the new Black. , ";;;;;;Trump;;;;;;Haha he quoted batman ;) (giving it back to you the people) that's funny;;;;;this isn't funny;;;;;;F Trump;;;;;;Obama sitting smugly watching, that evil piece of shit!;;;;;;SPLENDID DISPLAY OF THE BEAUTY OF DEMOCRACY. USA THE SHINING EXAMPLE. GOD BLESS USA AND THE PRESIDENT D. J TRUMP;;;;;;his thin skinned twitter fingers are going to blow up the entire earth.;;;;;;Did he really steal quavo line? ;;;;;;Socialism must be the path to a more democratic and more prosperous America !;;;;;;omg.... who voted this white nigger to the highest office in the land.... this white coon is nothing more than a twitter thug;;;;;;I just don't want him to build a wall the Mexicans got all the bad bitches !;;;;;;no;;;;;;I personally hate Trump. But, I do agree on why he's banning some Muslim countries. Who the fuck cares if there are millions of innocent Muslims, if it means we'll be safe, let's take that risk.;;;;;;Since you asked, here's why:;;;;;;;;;;;;"#1 Terrorism isn't a significant threat. Of the 20,000 dead worldwide from terrorism, 18,000 of those dead bodies are ""muslims killing other muslims"" NOT US. So far, none of those sand ******* have managed to nuke the other, so it isn't likely they'd get one and use it on us. They'd use it on each other first, and they haven't.";;;;;